
Assignment 1 

/* b. Write at least 10 SQL queries on the suitable database application using SQL DML
statements.
Note: Instructor will design the queries which demonstrate the use of concepts like Insert, Select,
Update, Delete with operators, functions, and set operator etc.
*/
       |
| Last login: Sun Jul 31 20:19:03 on ttys004
indraneelsarode@Indraneels-MacBook-Pro ~ % mysql -u root -p
Enter password: 
Welcome to the MySQL monitor.  Commands end with ; or \g.
Your MySQL connection id is 10
Server version: 8.0.30 MySQL Community Server - GPL

Copyright (c) 2000, 2022, Oracle and/or its affiliates.

Oracle is a registered trademark of Oracle Corporation and/or its
affiliates. Other names may be trademarks of their respective
owners.

Type 'help;' or '\h' for help. Type '\c' to clear the current input statement.

mysql> show databases
    -> ;
+--------------------+
| Database           |
+--------------------+
| information_schema |
| mysql              |
| performance_schema |
| sys                |
+--------------------+
4 rows in set (0.01 sec)

mysql> create database NBA;
Query OK, 1 row affected (0.01 sec)

mysql> use NBA
Database changed
mysql> create table team(name varchar(20),city varchar(20),championships int);
Query OK, 0 rows affected (0.01 sec)

mysql> select *from team;
Empty set (0.01 sec)

mysql> insert into team values("warriors","sanfransisco",6),("lakers","losangeles",15),("celtics","boston",17),("bulls","chicago",6);
Query OK, 4 rows affected (0.00 sec)
Records: 4  Duplicates: 0  Warnings: 0

mysql> select *from team;
+----------+--------------+---------------+
| name     | city         | championships |
+----------+--------------+---------------+
| warriors | sanfransisco |             6 |
| lakers   | losangeles   |            15 |
| celtics  | boston       |            17 |
| bulls    | chicago      |             6 |
+----------+--------------+---------------+
4 rows in set (0.00 sec)

mysql> select name from team;
+----------+
| name     |
+----------+
| warriors |
| lakers   |
| celtics  |
| bulls    |
+----------+
4 rows in set (0.00 sec)

mysql> select championships from team where city ="boston";
+---------------+
| championships |
+---------------+
|            17 |
+---------------+
1 row in set (0.00 sec)

mysql> select name  from team where championships>=6;
+----------+
| name     |
+----------+
| warriors |
| lakers   |
| celtics  |
| bulls    |
+----------+
4 rows in set (0.00 sec)

mysql> select city,championships from team;
+--------------+---------------+
| city         | championships |
+--------------+---------------+
| sanfransisco |             6 |
| losangeles   |            15 |
| boston       |            17 |
| chicago      |             6 |
+--------------+---------------+
4 rows in set (0.00 sec)

mysql> alter table team add column networth int;
Query OK, 0 rows affected (0.01 sec)
Records: 0  Duplicates: 0  Warnings: 0

mysql> select *from team;
+----------+--------------+---------------+----------+
| name     | city         | championships | networth |
+----------+--------------+---------------+----------+
| warriors | sanfransisco |             6 |     NULL |
| lakers   | losangeles   |            15 |     NULL |
| celtics  | boston       |            17 |     NULL |
| bulls    | chicago      |             6 |     NULL |
+----------+--------------+---------------+----------+
4 rows in set (0.00 sec)

mysql> alter table team add column players int;
Query OK, 0 rows affected (0.01 sec)
Records: 0  Duplicates: 0  Warnings: 0

mysql> select *from team;
+----------+--------------+---------------+----------+---------+
| name     | city         | championships | networth | players |
+----------+--------------+---------------+----------+---------+
| warriors | sanfransisco |             6 |     NULL |    NULL |
| lakers   | losangeles   |            15 |     NULL |    NULL |
| celtics  | boston       |            17 |     NULL |    NULL |
| bulls    | chicago      |             6 |     NULL |    NULL |
+----------+--------------+---------------+----------+---------+
4 rows in set (0.00 sec)

mysql> alter table team drop column players ;
Query OK, 0 rows affected (0.01 sec)
Records: 0  Duplicates: 0  Warnings: 0

mysql> select *from team;
+----------+--------------+---------------+----------+
| name     | city         | championships | networth |
+----------+--------------+---------------+----------+
| warriors | sanfransisco |             6 |     NULL |
| lakers   | losangeles   |            15 |     NULL |
| celtics  | boston       |            17 |     NULL |
| bulls    | chicago      |             6 |     NULL |
+----------+--------------+---------------+----------+
4 rows in set (0.00 sec)

mysql> alter table team modify column networth long ;
Query OK, 4 rows affected (0.02 sec)
Records: 4  Duplicates: 0  Warnings: 0

mysql> select *from team where city="boston" and name ="celtics";
+---------+--------+---------------+----------+
| name    | city   | championships | networth |
+---------+--------+---------------+----------+
| celtics | boston |            17 | NULL     |
+---------+--------+---------------+----------+
1 row in set (0.00 sec)

mysql> update team set networth = 30000000 where name ="warriors";
Query OK, 1 row affected (0.00 sec)
Rows matched: 1  Changed: 1  Warnings: 0

mysql> select *from team;
+----------+--------------+---------------+----------+
| name     | city         | championships | networth |
+----------+--------------+---------------+----------+
| warriors | sanfransisco |             6 | 30000000 |
| lakers   | losangeles   |            15 | NULL     |
| celtics  | boston       |            17 | NULL     |
| bulls    | chicago      |             6 | NULL     |
+----------+--------------+---------------+----------+
4 rows in set (0.00 sec)

mysql> insert into team values("nets","brooklyn",0,20000);
Query OK, 1 row affected (0.00 sec)

mysql> select *from team;
+----------+--------------+---------------+----------+
| name     | city         | championships | networth |
+----------+--------------+---------------+----------+
| warriors | sanfransisco |             6 | 30000000 |
| lakers   | losangeles   |            15 | NULL     |
| celtics  | boston       |            17 | NULL     |
| bulls    | chicago      |             6 | NULL     |
| nets     | brooklyn     |             0 | 20000    |
+----------+--------------+---------------+----------+
5 rows in set (0.00 sec)

mysql> delete from team where name ="nets";
Query OK, 1 row affected (0.00 sec)

mysql> select *from team;
+----------+--------------+---------------+----------+
| name     | city         | championships | networth |
+----------+--------------+---------------+----------+
| warriors | sanfransisco |             6 | 30000000 |
| lakers   | losangeles   |            15 | NULL     |
| celtics  | boston       |            17 | NULL     |
| bulls    | chicago      |             6 | NULL     |
+----------+--------------+---------------+----------+
4 rows in set (0.00 sec)

mysql> alter table team rename column championships to trophies;
Query OK, 0 rows affected (0.01 sec)
Records: 0  Duplicates: 0  Warnings: 0

mysql> select *from team;
+----------+--------------+----------+----------+
| name     | city         | trophies | networth |
+----------+--------------+----------+----------+
| warriors | sanfransisco |        6 | 30000000 |
| lakers   | losangeles   |       15 | NULL     |
| celtics  | boston       |       17 | NULL     |
| bulls    | chicago      |        6 | NULL     |
+----------+--------------+----------+----------+
4 rows in set (0.00 sec)

mysql> exit
Bye
indraneelsarode@Indraneels-MacBook-Pro ~ % 
